{
  "$schema": "../schemas/capabilities.schema.json",
  "manifestVersion": 1,
  "owner": "simplexidev/codex-toolkit",
  "generatedFrom": "develop/v2.0.0 capability audit",
  "layerOrder": ["deterministic", "jev", "agent", "stronger-agent"],
  "summary": { "total": 31, "supported": 10, "partial": 17, "gap": 4 },
  "capabilities": [
    {
      "id": "repo-navigation-impact",
      "title": "Repository navigation and impact",
      "tasks": ["locate files", "summarize changes", "map file ownership and affected .NET projects"],
      "coverage": "supported",
      "existingSupport": [
        { "kind": "agent-tool", "id": "repo locate", "scope": "Bounded tracked and unignored path-name search." },
        { "kind": "agent-tool", "id": "repo changed-files", "scope": "Merge-base-aware changed-file inventory." },
        { "kind": "agent-tool", "id": "repo summary", "scope": "Bounded change classifications plus local branch and upstream divergence facts." },
        { "kind": "agent-tool", "id": "repo affected-projects", "scope": "Maps changes to .NET project and test dependencies." },
        { "kind": "agent-tool", "id": "repo ownership", "scope": "Maps a file to evaluated Compile ownership and transitive project impact." }
      ],
      "opportunities": { "deterministic": "Keep path and project graph discovery in AgentTool; use rg for symbols.", "jev": "No fit for exact path or graph facts.", "agent": "Interpret impact after deterministic narrowing." },
      "routing": { "primary": "deterministic", "fallback": ["agent"], "reason": "Paths and project references are exact repository facts." },
      "staticCost": { "level": "none", "activation": "none", "loads": [], "concern": "Commands need no skill activation; avoid loading broad repository maps." },
      "gaps": ["Non-.NET dependency graphs are not modeled."],
      "duplication": ["run-dotnet-tests consumes affected-project output without duplicating discovery."],
      "recommendedAction": "Retain command-only routing and add graph types only when an owned runtime needs them."
    },
    {
      "id": "git-local-state",
      "title": "Local Git safety and commit preparation",
      "tasks": ["inspect worktree", "check staged scope", "prepare commits"],
      "coverage": "supported",
      "existingSupport": [
        { "kind": "agent-tool", "id": "git state", "scope": "Structured branch, status and operation state." },
        { "kind": "agent-tool", "id": "git summary", "scope": "Adds bounded changes and upstream ahead/behind counts without mutation." },
        { "kind": "agent-tool", "id": "git prepare-commit", "scope": "Safety and whitespace checks without committing." },
        { "kind": "skill", "id": "prepare-commit", "scope": "Explicit staging and unrelated-work preservation guidance." }
      ],
      "opportunities": { "deterministic": "Keep state, diff and whitespace facts structured.", "jev": "No fit for Git facts or authorization.", "agent": "Judge intended scope and compose the commit." },
      "routing": { "primary": "deterministic", "fallback": ["agent"], "reason": "Git state is exact; intent remains an agent decision." },
      "staticCost": { "level": "low", "activation": "implicit", "loads": ["prepare-commit"], "concern": "Load one compact skill only at commit time." },
      "gaps": ["No commit or push mutation is intentionally automated."],
      "duplication": ["finish-pr repeats final Git safety checks by design."],
      "recommendedAction": "Keep the mutation boundary caller-controlled."
    },
    {
      "id": "github-issues",
      "title": "GitHub issues",
      "tasks": ["inspect an issue", "start an issue branch", "triage issue metadata"],
      "coverage": "partial",
      "existingSupport": [
        { "kind": "agent-tool", "id": "git issue-start", "scope": "Validates an open issue and creates a safe local branch." },
        { "kind": "skill", "id": "issue-start", "scope": "Narrow branch-start workflow." },
        { "kind": "skill", "id": "roadmap-next", "scope": "Selects from bounded issue and dependency metadata." }
      ],
      "opportunities": { "deterministic": "Add a read-only issue-summary command only if repeated platform output proves noisy.", "jev": "Choice can break ties in sanitized issue prose after metadata filtering.", "agent": "Understand requirements, ask clarifying questions and plan work." },
      "routing": { "primary": "deterministic", "fallback": ["jev", "agent"], "reason": "State and dependency metadata narrow candidates before semantic interpretation." },
      "staticCost": { "level": "low", "activation": "explicit", "loads": ["issue-start", "roadmap-next"], "concern": "Do not activate roadmap selection for ordinary issue work." },
      "gaps": ["No structured issue read, create, edit, label or close support."],
      "duplication": ["roadmap-next and issue-start are sequential, not competing workflows."],
      "recommendedAction": "Measure gh issue-output failures before adding one consolidated GitHub work-management skill."
    },
    {
      "id": "github-pull-requests",
      "title": "GitHub pull requests",
      "tasks": ["prepare a PR", "inspect PR status", "create or update a PR"],
      "coverage": "partial",
      "existingSupport": [
        { "kind": "agent-tool", "id": "github prepare-pr", "scope": "Local safety and whitespace preparation." },
        { "kind": "agent-tool", "id": "github pr-status", "scope": "Structured current PR status and checks." },
        { "kind": "skill", "id": "finish-pr", "scope": "Authorized commit, push and PR workflow." }
      ],
      "opportunities": { "deterministic": "Normalize bounded PR metadata and check summaries.", "jev": "No fit for merge authority or exact check state.", "agent": "Write summaries and perform authorized platform mutations." },
      "routing": { "primary": "deterministic", "fallback": ["agent"], "reason": "Preparation and status precede agent-authored PR content." },
      "staticCost": { "level": "low", "activation": "explicit", "loads": ["finish-pr"], "concern": "Explicit activation prevents premature external mutations." },
      "gaps": ["AgentTool intentionally does not create, update or merge PRs."],
      "duplication": ["prepare-commit and finish-pr share safety checks."],
      "recommendedAction": "Retain the authority boundary; improve status normalization with evidence from real failures."
    },
    {
      "id": "github-reviews",
      "title": "GitHub reviews",
      "tasks": ["read review comments", "triage feedback", "address findings"],
      "coverage": "supported",
      "existingSupport": [
        { "kind": "agent-tool", "id": "github review-comments", "scope": "Downloads paginated inline PR comments to a bounded artifact." },
        { "kind": "skill", "id": "address-pr-review", "scope": "Evidence-backed dispositions and targeted fixes." },
        { "kind": "agent", "id": "reviewer", "scope": "Independent read-only review for requested or high-risk diffs." }
      ],
      "opportunities": { "deterministic": "Preserve IDs, paths, lines and resolution state.", "jev": "Categorize only large sanitized comment sets; never dismiss security or uncertain feedback.", "agent": "Validate each finding against code and implement warranted fixes." },
      "routing": { "primary": "deterministic", "fallback": ["jev", "agent", "stronger-agent"], "reason": "Exact comment retrieval precedes optional clustering and code reasoning." },
      "staticCost": { "level": "medium", "activation": "implicit", "loads": ["address-pr-review"], "concern": "The reviewer agent loads only for explicit or substantial high-risk review." },
      "gaps": ["Top-level reviews and conversation threads are not normalized with inline comments."],
      "duplication": ["Reviewer and address-pr-review have distinct pre-review and post-review roles."],
      "recommendedAction": "Extend one review-comments surface if missing thread types cause observed misses."
    },
    {
      "id": "github-actions",
      "title": "GitHub Actions and run diagnostics",
      "tasks": ["inspect workflow runs", "summarize failed jobs", "retrieve bounded logs", "rerun authorized jobs"],
      "coverage": "gap",
      "existingSupport": [
        { "kind": "agent-tool", "id": "github pr-status", "scope": "Shows PR check rollups but not run or job detail." },
        { "kind": "agent-tool", "id": "logs summarize", "scope": "Compacts a caller-provided local log." }
      ],
      "opportunities": { "deterministic": "Add read-only run, job and failed-log normalization with strict bounds.", "jev": "No fit until deterministic failure excerpts leave a large ambiguous set.", "agent": "Diagnose the first causal failure and decide whether a rerun is justified." },
      "routing": { "primary": "deterministic", "fallback": ["agent"], "reason": "Run state and logs should be fetched and bounded before diagnosis." },
      "staticCost": { "level": "none", "activation": "none", "loads": [], "concern": "Do not add always-loaded Actions instructions." },
      "gaps": ["No run/job/artifact/log inspection command.", "No scoped rerun workflow."],
      "duplication": ["Generic log summarization can be reused after retrieval."],
      "recommendedAction": "Prioritize a consolidated github runs command and one CI-triage skill after fixtures define bounds."
    },
    {
      "id": "github-releases",
      "title": "GitHub releases",
      "tasks": ["inspect tags and releases", "draft a release", "verify uploaded assets"],
      "coverage": "partial",
      "existingSupport": [
        { "kind": "workflow", "id": "release.yml", "scope": "Builds a source archive, checksum and draft GitHub release for a tag." },
        { "kind": "agent-tool", "id": "release", "scope": "Creates the toolkit source archive." },
        { "kind": "skill", "id": "release-verify", "scope": "Enumerates executed and missing release gates." }
      ],